<?xml version="1.0" encoding="UTF-8"?>
<RequestData  xmlns:xsi="http://www.w3.org/2001/XMLSchema-instance"  xsi:noNamespaceSchemaLocation="schema/netflowFlowset.xsd">
<OptionsTemplateFlowset>
	<OptionsTemplate id="1" templateId="356">
		<Scope id="1" length="2" />
		<Scope id="2" length="2" />
		<Scope id="3" length="2" />
		<Field id="1" length="4" />
		<Field id="2" length="4" />
		<Field id="3" length="4"/>
		<Field id="4"/>
		<Field id="5"/>
		<Field id="12"/>
		<Field id="15"/>
		<Field id="34"/>
	</OptionsTemplate>
	<OptionsTemplate id="2" templateId="357">
		<Scope id="1" length="2" />
		<Scope id="2" length="2" />
		<Field id="1" length="4" />
		<Field id="2" length="4" />
		<Field id="3" length="4"/>
		<Field id="4"/>
		<Field id="6"/>
		<Field id="27"/>
		<Field id="28"/>
		<Field id="62"/>
	</OptionsTemplate>
	<OptionsTemplate id="3" templateId="358">
		<Scope id="3" length="2" />
		<Scope id="4" length="4" />
		<Field id="70"  />
		<Field id="71"  />
		<Field id="56" />
		<Field id="57"/>
		<Field id="7"/>
		<Field id="8"/>
		<Field id="32"/>
		<Field id="33"/>
	</OptionsTemplate>
	<OptionsTemplate id="4" templateId="359">
		<Field id="14" length="2" />
		<Field id="16" length="4" />
	</OptionsTemplate>
</OptionsTemplateFlowset>
</RequestData>